1c1
< 23:57:35.938066 IP 127.0.0.1.55920 > 127.0.0.1.80: Flags [S], seq 928549246, win 32767, options [mss 16396,sackOK,TS val 1306300950 ecr 0,nop,wscale 2], length 0
---
> 22:57:35.938066 IP 127.0.0.1.55920 > 127.0.0.1.80: Flags [S], seq 928549246, win 32767, options [mss 16396,sackOK,TS val 1306300950 ecr 0,nop,wscale 2], length 0
6c6
< 23:57:35.938122 IP 127.0.0.1.80 > 127.0.0.1.55920: Flags [S.], seq 930778609, ack 928549247, win 32767, options [mss 16396,sackOK,TS val 1306300950 ecr 1306300950,nop,wscale 2], length 0
---
> 22:57:35.938122 IP 127.0.0.1.80 > 127.0.0.1.55920: Flags [S.], seq 930778609, ack 928549247, win 32767, options [mss 16396,sackOK,TS val 1306300950 ecr 1306300950,nop,wscale 2], length 0
11c11
< 23:57:35.938167 IP 127.0.0.1.55920 > 127.0.0.1.80: Flags [.], ack 1, win 8192, options [nop,nop,TS val 1306300950 ecr 1306300950], length 0
---
> 22:57:35.938167 IP 127.0.0.1.55920 > 127.0.0.1.80: Flags [.], ack 1, win 8192, options [nop,nop,TS val 1306300950 ecr 1306300950], length 0
16c16
< 23:57:35.939423 IP 127.0.0.1.55920 > 127.0.0.1.80: Flags [P.], seq 1:203, ack 1, win 8192, options [nop,nop,TS val 1306300951 ecr 1306300950], length 202
---
> 22:57:35.939423 IP 127.0.0.1.55920 > 127.0.0.1.80: Flags [P.], seq 1:203, ack 1, win 8192, options [nop,nop,TS val 1306300951 ecr 1306300950], length 202
33c33
< 23:57:35.940474 IP 127.0.0.1.80 > 127.0.0.1.55920: Flags [.], ack 203, win 8192, options [nop,nop,TS val 1306300952 ecr 1306300951], length 0
---
> 22:57:35.940474 IP 127.0.0.1.80 > 127.0.0.1.55920: Flags [.], ack 203, win 8192, options [nop,nop,TS val 1306300952 ecr 1306300951], length 0
38c38
< 23:57:35.941232 IP 127.0.0.1.80 > 127.0.0.1.55920: Flags [P.], seq 1:5560, ack 203, win 8192, options [nop,nop,TS val 1306300953 ecr 1306300951], length 5559
---
> 22:57:35.941232 IP 127.0.0.1.80 > 127.0.0.1.55920: Flags [P.], seq 1:5560, ack 203, win 8192, options [nop,nop,TS val 1306300953 ecr 1306300951], length 5559
390c390
< 23:57:35.941260 IP 127.0.0.1.55920 > 127.0.0.1.80: Flags [.], ack 5560, win 12383, options [nop,nop,TS val 1306300953 ecr 1306300953], length 0
---
> 22:57:35.941260 IP 127.0.0.1.55920 > 127.0.0.1.80: Flags [.], ack 5560, win 12383, options [nop,nop,TS val 1306300953 ecr 1306300953], length 0
395c395
< 23:57:37.229575 IP 127.0.0.1.55920 > 127.0.0.1.80: Flags [F.], seq 203, ack 5560, win 12383, options [nop,nop,TS val 1306302241 ecr 1306300953], length 0
---
> 22:57:37.229575 IP 127.0.0.1.55920 > 127.0.0.1.80: Flags [F.], seq 203, ack 5560, win 12383, options [nop,nop,TS val 1306302241 ecr 1306300953], length 0
400c400
< 23:57:37.230839 IP 127.0.0.1.80 > 127.0.0.1.55920: Flags [F.], seq 5560, ack 204, win 8192, options [nop,nop,TS val 1306302243 ecr 1306302241], length 0
---
> 22:57:37.230839 IP 127.0.0.1.80 > 127.0.0.1.55920: Flags [F.], seq 5560, ack 204, win 8192, options [nop,nop,TS val 1306302243 ecr 1306302241], length 0
405c405
< 23:57:37.230900 IP 127.0.0.1.55920 > 127.0.0.1.80: Flags [.], ack 5561, win 12383, options [nop,nop,TS val 1306302243 ecr 1306302243], length 0
---
> 22:57:37.230900 IP 127.0.0.1.55920 > 127.0.0.1.80: Flags [.], ack 5561, win 12383, options [nop,nop,TS val 1306302243 ecr 1306302243], length 0
