1c1
< 23:57:35.938066 IP 127.0.0.1.55920 > 127.0.0.1.80: Flags [S], seq 928549246, win 32767, options [mss 16396,sackOK,TS val 1306300950 ecr 0,nop,wscale 2], length 0
---
> 22:57:35.938066 IP 127.0.0.1.55920 > 127.0.0.1.80: Flags [S], seq 928549246, win 32767, options [mss 16396,sackOK,TS val 1306300950 ecr 0,nop,wscale 2], length 0
4c4
< 23:57:35.938122 IP 127.0.0.1.80 > 127.0.0.1.55920: Flags [S.], seq 930778609, ack 928549247, win 32767, options [mss 16396,sackOK,TS val 1306300950 ecr 1306300950,nop,wscale 2], length 0
---
> 22:57:35.938122 IP 127.0.0.1.80 > 127.0.0.1.55920: Flags [S.], seq 930778609, ack 928549247, win 32767, options [mss 16396,sackOK,TS val 1306300950 ecr 1306300950,nop,wscale 2], length 0
7c7
< 23:57:35.938167 IP 127.0.0.1.55920 > 127.0.0.1.80: Flags [.], ack 1, win 8192, options [nop,nop,TS val 1306300950 ecr 1306300950], length 0
---
> 22:57:35.938167 IP 127.0.0.1.55920 > 127.0.0.1.80: Flags [.], ack 1, win 8192, options [nop,nop,TS val 1306300950 ecr 1306300950], length 0
10c10
< 23:57:35.939423 IP 127.0.0.1.55920 > 127.0.0.1.80: Flags [P.], seq 1:203, ack 1, win 8192, options [nop,nop,TS val 1306300951 ecr 1306300950], length 202
---
> 22:57:35.939423 IP 127.0.0.1.55920 > 127.0.0.1.80: Flags [P.], seq 1:203, ack 1, win 8192, options [nop,nop,TS val 1306300951 ecr 1306300950], length 202
12,19c12,18
< M...M...GET / HTTP/1.1
< Host: localhost
< User-Agent: ELinks/0.10.4-7-debian (textmode; Linux 2.6.11-1-686-smp i686; 132x56-2)
< Accept: */*
< Accept-Encoding: gzip
< Accept-Language: en
< Connection: Keep-Alive
< 
---
> M...M...GET / HTTP/1.1
> Host: localhost
> User-Agent: ELinks/0.10.4-7-debian (textmode; Linux 2.6.11-1-686-smp i686; 132x56-2)
> Accept: */*
> Accept-Encoding: gzip
> Accept-Language: en
> Connection: Keep-Alive
21c20,21
< 23:57:35.940474 IP 127.0.0.1.80 > 127.0.0.1.55920: Flags [.], ack 203, win 8192, options [nop,nop,TS val 1306300952 ecr 1306300951], length 0
---
> 
> 22:57:35.940474 IP 127.0.0.1.80 > 127.0.0.1.55920: Flags [.], ack 203, win 8192, options [nop,nop,TS val 1306300952 ecr 1306300951], length 0
24c24
< 23:57:35.941232 IP 127.0.0.1.80 > 127.0.0.1.55920: Flags [P.], seq 1:5560, ack 203, win 8192, options [nop,nop,TS val 1306300953 ecr 1306300951], length 5559
---
> 22:57:35.941232 IP 127.0.0.1.80 > 127.0.0.1.55920: Flags [P.], seq 1:5560, ack 203, win 8192, options [nop,nop,TS val 1306300953 ecr 1306300951], length 5559
26,36c26,36
< M...M...HTTP/1.1 200 OK
< Date: Wed, 06 Jul 2005 03:57:35 GMT
< Server: Apache/1.3.33
< Last-Modified: Sun, 15 Aug 2004 00:43:41 GMT
< ETag: "6e80f0-148a-411eb1bd"
< Accept-Ranges: bytes
< Content-Length: 5258
< Keep-Alive: timeout=15, max=100
< Connection: Keep-Alive
< Content-Type: text/html; charset=iso-8859-1
< 
---
> M...M...HTTP/1.1 200 OK
> Date: Wed, 06 Jul 2005 03:57:35 GMT
> Server: Apache/1.3.33
> Last-Modified: Sun, 15 Aug 2004 00:43:41 GMT
> ETag: "6e80f0-148a-411eb1bd"
> Accept-Ranges: bytes
> Content-Length: 5258
> Keep-Alive: timeout=15, max=100
> Connection: Keep-Alive
> Content-Type: text/html; charset=iso-8859-1
> 
182c182
< 23:57:35.941260 IP 127.0.0.1.55920 > 127.0.0.1.80: Flags [.], ack 5560, win 12383, options [nop,nop,TS val 1306300953 ecr 1306300953], length 0
---
> 22:57:35.941260 IP 127.0.0.1.55920 > 127.0.0.1.80: Flags [.], ack 5560, win 12383, options [nop,nop,TS val 1306300953 ecr 1306300953], length 0
185c185
< 23:57:37.229575 IP 127.0.0.1.55920 > 127.0.0.1.80: Flags [F.], seq 203, ack 5560, win 12383, options [nop,nop,TS val 1306302241 ecr 1306300953], length 0
---
> 22:57:37.229575 IP 127.0.0.1.55920 > 127.0.0.1.80: Flags [F.], seq 203, ack 5560, win 12383, options [nop,nop,TS val 1306302241 ecr 1306300953], length 0
188c188
< 23:57:37.230839 IP 127.0.0.1.80 > 127.0.0.1.55920: Flags [F.], seq 5560, ack 204, win 8192, options [nop,nop,TS val 1306302243 ecr 1306302241], length 0
---
> 22:57:37.230839 IP 127.0.0.1.80 > 127.0.0.1.55920: Flags [F.], seq 5560, ack 204, win 8192, options [nop,nop,TS val 1306302243 ecr 1306302241], length 0
191c191
< 23:57:37.230900 IP 127.0.0.1.55920 > 127.0.0.1.80: Flags [.], ack 5561, win 12383, options [nop,nop,TS val 1306302243 ecr 1306302243], length 0
---
> 22:57:37.230900 IP 127.0.0.1.55920 > 127.0.0.1.80: Flags [.], ack 5561, win 12383, options [nop,nop,TS val 1306302243 ecr 1306302243], length 0
